{
  "$schema": "http://json-schema.org/draft-07/schema#",
  "$id": "https://github.com/newmassrael/scxml-core-engine/blob/main/schemas/sce-saved-state.v1.schema.json",
  "x-sce-schema-status": "pre-release",
  "title": "SCE saved state (wire schema v1)",
  "description": "A datamodel=\"sce-static\" machine's whole state, saved at a macrostep boundary and restored into a new process in place of initialize (docs/SCE_ACCEPTED_SUBSET.md §2.15, \"Saving and restoring\"). The same document on every backend: what one backend saved, another restores. Producers and readers are the runtimes — sce_rust_runtime::saved_state (Rust) and com.sce.runtime.SavedState (Kotlin) — and the generated save/restore of each machine. The stability status of this surface lives in this header alone — see SCE_WIRE_CONTRACTS.md.",
  "type": "object",
  "required": ["format", "shape", "configuration", "current", "variables", "history", "pending", "invokes", "hostinvokes", "hostinvoketoken", "sendseq", "external"],
  "additionalProperties": false,
  "properties": {
    "format": {
      "description": "The format version. Always 1 for this revision; a reader refuses any other.",
      "const": 1
    },
    "shape": {
      "description": "The SHA-256, as lowercase hex, of the document's shape as the generator computes it: every state with its kind and parent in document order, every <history> with its id, kind and parent, every <invoke type=\"scxml\"> with its id and the state that holds it, every <invoke> a declared host invoker serves with its type, its id and the state that holds it, every variable with its type and bound, a record's fields of its schema's first revision with their types, an enum's variants of its first revision. A machine refuses a saved state of another shape. Not the document's source hash: a guard, an action, an initial value or a comment changed leaves the shape as it was, and so does a field a later revision of a record schema added, or a variant a later revision of an enum added (docs/adr/0044). A state that names `revisions` carries the revised shape instead: the digest of the same text with one line more, which a reader that predates revisions does not know and refuses.",
      "type": "string",
      "pattern": "^[0-9a-f]{64}$"
    },
    "revisions": {
      "description": "The revision each record schema and each enum past its first was saved at (docs/adr/0044): the record schemas keyed by the event each declares, then the enums keyed by `enum:` and the enum's document — a standard document by its `sce:std/...` name, any other by its path relative to the machine's own document's directory, `.` and `..` folded, `/`-separated (the document, not an alias it is imported under, so the same on every backend, in every checkout, and across a renamed alias) — each run ordered by its key. Absent when every record schema and enum the state holds is in its first revision, which is every state saved before schemas had revisions; never empty. A restore refuses a revision of a schema or an enum the machine holds no value of, one later than the machine's own, and one whose `fields` is not the machine's digest of that revision; it refuses an enum value that names a variant a later revision added than the one it was saved at; and it then gives each record saved at an earlier revision (a record variable, each element of a list of records) the default of every field a later revision added, and refuses a record that already holds such a field.",
      "type": "object",
      "minProperties": 1,
      "additionalProperties": {
        "type": "object",
        "required": ["revision", "fields"],
        "additionalProperties": false,
        "properties": {
          "revision": {
            "description": "The schema's or the enum's sce:revision where the state was saved: 2 or later, since one in its first revision is left out.",
            "type": "integer",
            "minimum": 2
          },
          "fields": {
            "description": "The SHA-256, as lowercase hex, of what that revision declares: for a record schema, each field it has (its sce:since at most the revision, or none), in the schema's order, with its type and the first-revision variant names of its enum; for an enum, the names of the variants it has, sorted. Not a default, a since or a variant's value, which a saved state does not name.",
            "type": "string",
            "pattern": "^[0-9a-f]{64}$"
          }
        }
      }
    },
    "configuration": {
      "description": "The active configuration as state ids, in document order. A restore refuses one that is not a configuration of the document.",
      "type": "array",
      "items": { "type": "string" },
      "minItems": 1
    },
    "current": {
      "description": "The current leaf as a state id — which of a <parallel>'s regions the machine last stood in, which the configuration alone cannot say.",
      "type": "string"
    },
    "variables": {
      "description": "Every variable, the machine's own included, keyed by its document id in declaration order.",
      "type": "object",
      "additionalProperties": { "$ref": "#/definitions/value" }
    },
    "history": {
      "description": "What each <history> recorded when its parent was last exited (W3C SCXML 3.10): the active children of its parent for a shallow one, the active atomic states below it for a deep one. Keyed by the history's id, in order of id; each value is state ids in document order. A history that has recorded nothing is absent, and a document with no <history> has {}. A restore refuses an id the document does not declare, a state that is not below the history's parent, and a value that is part of no configuration of the document. Object member names are unique: a text that repeats one is not this format.",
      "type": "object",
      "additionalProperties": {
        "type": "array",
        "items": { "type": "string" },
        "minItems": 1
      }
    },
    "pending": {
      "description": "The delayed <send>s still waiting (W3C SCXML 6.2), in the order they would be delivered: earliest first, entries due at the same moment in the order they were sent. Each is written as the moment it comes due on the wall clock of the host that saved it, not as a wait: a wait would start again when the process came back, and a timer that ran out while it was dead would be late by exactly as long as it was dead. A restore arms each to come due when its moment does, and one already due to come due now, in this order. A document that makes a delayed send to a parent, an invocation or a child session has no saved state: the session it waits for is not part of this one.",
      "type": "array",
      "items": {
        "oneOf": [
          { "$ref": "#/definitions/pendingRaise" },
          { "$ref": "#/definitions/pendingInternal" },
          { "$ref": "#/definitions/pendingHost" }
        ]
      }
    },
    "invokes": {
      "description": "The <invoke type=\"scxml\">s whose child session is running (W3C SCXML 6.4), by the id the document gives each, in document order. A child session is not saved: a restore starts each listed one again from its beginning, under the same id, as entering its state would, so a child's progress is lost and `done.invoke.<id>` still names the invocation the document wrote. One whose child has ended is absent, because its done.invoke is in `external` or already taken, and an invocation complete must not run twice. A restore refuses an id the document does not invoke, one whose state the configuration does not stand in, and one named twice. A document with an <invoke> a restore cannot start again — a mesh-rpc call, a mesh peer — has no saved state: what it was started with is not part of this one. An <invoke> the host runs is in `hostinvokes`.",
      "type": "array",
      "items": { "type": "string", "minLength": 1 },
      "uniqueItems": true
    },
    "hostinvokes": {
      "description": "The <invoke>s a declared host invoker is running (W3C SCXML 6.4.1), ordered by type and then id. A restore starts each again from the request it was started with — the element is not evaluated a second time — with the deadline it had left, at the top of the first macrostep the host drives, ahead of the saved external queue; the host is told it is a restart (`restarted`) and receives a new token. One whose deadline came due while the machine was away is not started: the document receives `error.invoke.<id>` and the host nothing. One whose completion is already in `external` is absent. A restore refuses an invocation the document does not hand to a host under that type and id, one whose state the configuration does not stand in, and one named twice.",
      "type": "array",
      "items": { "$ref": "#/definitions/hostInvoke" }
    },
    "hostinvoketoken": {
      "description": "The token the next host-run start receives, a text of digits within a signed 64-bit count. A restore carries on from it, so a start it makes is never given a token an earlier run already handed to a host that may still answer with it.",
      "$ref": "#/definitions/token"
    },
    "sendseq": {
      "description": "How many ids the machine has generated for a <send idlocation>: the number the last one carried, a text of digits within a signed 64-bit count. The ids are `_auto_send_` and a decimal number counted from one. A restore carries on from it, so an id it generates is never one an earlier run already handed to the document, which may still hold it in a variable.",
      "$ref": "#/definitions/token"
    },
    "external": {
      "description": "The external queue, front first: events raised to the machine that it has not yet been driven through. Only the internal queue is empty at a macrostep boundary. Restored in this order, behind nothing. A typed payload is not saved; it is lifted again from `data` on delivery.",
      "type": "array",
      "items": {
        "type": "object",
        "required": ["name", "data", "type", "sendid", "origin", "origintype", "invokeid", "hostinvoketoken"],
        "additionalProperties": false,
        "properties": {
          "name": { "description": "The event name, as the document spells it.", "type": "string", "minLength": 1 },
          "data": { "description": "_event.data, as the wire carries it.", "type": "string" },
          "type": { "description": "_event.type.", "enum": ["internal", "external", "platform"] },
          "sendid": { "description": "_event.sendid.", "type": "string" },
          "origin": { "description": "_event.origin.", "type": "string" },
          "origintype": { "description": "_event.origintype.", "type": "string" },
          "invokeid": { "description": "_event.invokeid.", "type": "string" },
          "hostinvoketoken": {
            "description": "The token a host-run invocation's completion or failure was stamped with when the engine accepted it, null for any other event. The engine refuses a host done.invoke that carries none when it is dequeued, because it may be a cancelled run's late reply, so an accepted one that is still queued has to keep its stamp across a save. Written as it was, never inferred from the event's name: an event a host raised through the ordinary door and the engine had yet to refuse must still be refused.",
            "oneOf": [{ "type": "null" }, { "$ref": "#/definitions/token" }]
          }
        }
      }
    }
  },
  "definitions": {
    "token": {
      "description": "A host-run start's token: a text holding a non-negative decimal whole number no larger than 9223372036854775807 (every 64-bit integer in this format is a text). A reader refuses one outside that range, which a pattern cannot say.",
      "type": "string",
      "pattern": "^[0-9]{1,19}$"
    },
    "hostInvoke": {
      "description": "An <invoke> a declared host invoker is running, as it is started again: every field is what the request the host was handed carried.",
      "type": "object",
      "required": ["type", "id", "src", "params", "data", "content", "due"],
      "additionalProperties": false,
      "properties": {
        "type": { "description": "The `type` the <invoke> named.", "type": "string", "minLength": 1 },
        "id": { "description": "The invoke's id, which done.invoke.<id> names.", "type": "string", "minLength": 1 },
        "src": { "description": "<invoke src>, empty when the document named none.", "type": "string" },
        "params": {
          "description": "<param> values by name, ordered by name; a repeated name keeps every value in document order. Without the engine's own deadline parameter, which `due` holds.",
          "type": "object",
          "additionalProperties": { "type": "array", "items": { "type": "string" } }
        },
        "data": { "description": "The namelist and <param> pairs as JSON, as the request carried them, in the order the saving backend built them.", "type": "string" },
        "content": { "description": "Inline <content>, empty when the document carried none.", "type": "string" },
        "due": {
          "description": "When its deadline comes due, as `pending`'s `due` is written; null for an invocation that has none. Already past for one that came due while the machine waited to be restarted.",
          "oneOf": [{ "type": "null" }, { "$ref": "#/definitions/due" }]
        }
      }
    },
    "due": {
      "description": "When a waiting send comes due: milliseconds since the Unix epoch on the saving host's wall clock, a text holding a non-negative decimal whole number no larger than 9223372036854775807 (every 64-bit integer in this format is a text). A reader refuses one outside that range, which a pattern cannot say.",
      "type": "string",
      "pattern": "^[0-9]{1,19}$"
    },
    "pendingRaise": {
      "description": "A delayed send of an event to this session's external queue.",
      "type": "object",
      "required": ["due", "act", "event", "data", "sendid", "origin"],
      "additionalProperties": false,
      "properties": {
        "due": { "$ref": "#/definitions/due" },
        "act": { "const": "raise" },
        "event": { "description": "The event name, as the document spells it.", "type": "string", "minLength": 1 },
        "data": { "description": "_event.data, as the wire carries it.", "type": "string" },
        "sendid": { "description": "The send's id: _event.sendid on delivery, and what a <cancel> names.", "type": "string" },
        "origin": { "description": "_event.origin: the session that sent it.", "type": "string" }
      }
    },
    "pendingInternal": {
      "description": "A delayed send of an event to this session's internal queue (target #_internal).",
      "type": "object",
      "required": ["due", "act", "event", "data", "sendid", "origin"],
      "additionalProperties": false,
      "properties": {
        "due": { "$ref": "#/definitions/due" },
        "act": { "const": "internal" },
        "event": { "description": "The event name, as the document spells it.", "type": "string", "minLength": 1 },
        "data": { "description": "_event.data, as the wire carries it.", "type": "string" },
        "sendid": { "description": "The send's id, which a <cancel> names.", "type": "string" },
        "origin": { "description": "_event.origin; empty on a backend whose internal events carry none.", "type": "string" }
      }
    },
    "pendingHost": {
      "description": "A delayed send a host-served processor performs when it comes due (W3C SCXML 6.2.5). Every field is what the document wrote, so the handler sees the request it would have seen had there been no delay.",
      "type": "object",
      "required": ["due", "act", "type", "event", "target", "content", "params", "sendid", "data", "invokeid"],
      "additionalProperties": false,
      "properties": {
        "due": { "$ref": "#/definitions/due" },
        "act": { "const": "host" },
        "type": { "description": "The processor type the send named.", "type": "string" },
        "event": { "description": "<send event>.", "type": "string" },
        "target": { "description": "<send target>, empty when the document named none.", "type": "string" },
        "content": { "description": "Inline <content>, empty when the document carried none.", "type": "string" },
        "params": {
          "description": "<param> values by name, in order of name; a repeated name keeps every value in document order.",
          "type": "object",
          "additionalProperties": { "type": "array", "items": { "type": "string" } }
        },
        "sendid": { "description": "The send's id.", "type": "string" },
        "data": { "description": "_event.data as a local delivery of the send would carry it.", "type": "string" },
        "invokeid": { "description": "_event.invokeid of the event being processed when the send executed.", "type": "string" }
      }
    },
    "value": {
      "description": "A value as its sce:type writes it. A whole number up to 32 bits is a JSON number; a 64-bit one (int64, uint64) is a text holding its decimal digits, so no reader that holds numbers as doubles loses its low bits. A real is a number, or one of the texts NaN, Infinity, -Infinity, which JSON has no number for. A bool is a JSON boolean, a string a text, bytes an array of numbers 0 to 255, a list an array of its elements, a record an object keyed by its schema's field ids. The document's types decide which applies; this schema admits their union.",
      "oneOf": [
        { "type": "number" },
        { "type": "string" },
        { "type": "boolean" },
        { "type": "array", "items": { "$ref": "#/definitions/value" } },
        { "type": "object", "additionalProperties": { "$ref": "#/definitions/value" } }
      ]
    }
  }
}
