{"format":1,"shape":"cb771df5efc33bf380bfd5a267ca027b408f8cd064bbc7eec5ca0266e23d06f5","configuration":["reading"],"current":"reading","variables":{"last":{"level":4,"layout":"week","urgent":true},"taken":1,"refusals":0},"history":{},"pending":[],"invokes":[],"hostinvokes":[],"hostinvoketoken":"0","sendseq":"0","external":[],"revisions":{"reading.revised":{"revision":3,"fields":"e511eddacf1d4e220c85f78c95988fe26a2a1319cf119cb085f1a84f4f197f8d"}}}
