{"format":1,"shape":"f7e359f42783c9931d2c1dbf44f80fee16a403f0e56b70bbc26ff6874c901834","configuration":["waiting"],"current":"waiting","variables":{"last":{"level":"low","count":0},"taken":0,"refusals":0},"history":{},"pending":[{"due":"1700000001000","act":"raise","event":"signal.raised","data":"{\"count\":7,\"level\":\"high\"}","sendid":"later","origin":""}],"invokes":[],"hostinvokes":[],"hostinvoketoken":"0","sendseq":"0","external":[]}
