{"format":1,"shape":"cb771df5efc33bf380bfd5a267ca027b408f8cd064bbc7eec5ca0266e23d06f5","configuration":["reading"],"current":"reading","variables":{"last":{"level":5,"layout":"day"},"taken":2,"refusals":0},"history":{},"pending":[],"invokes":[],"hostinvokes":[],"hostinvoketoken":"0","sendseq":"0","external":[],"revisions":{"reading.revised":{"revision":2,"fields":"d9ba6a71207a3f219929c8fda298d7a35c76cb7950cc287ae2fa8a8b8ff45ad7"}}}
