{"format":1,"shape":"11dbc3cc8b1f883cc9da011d2d5c3968ac0eeb404a0f494deede91552cd6623d","configuration":["reading"],"current":"reading","variables":{"last":{"level":4},"taken":1,"refusals":0},"history":{},"pending":[],"invokes":[],"hostinvokes":[],"hostinvoketoken":"0","sendseq":"0","external":[{"name":"reading.revised","data":"{\"level\":5}","type":"external","sendid":"","origin":"","origintype":"","invokeid":"","hostinvoketoken":null}]}
